{
  "schemaVersion": "1.0.0",
  "releaseId": "laidies-episode-03-the-burn-book-problem-v1",
  "releaseType": "EPISODE",
  "version": 1,
  "status": "HOLD",
  "supersedes": null,
  "canonical": {
    "title": "The Burn Book Problem",
    "description": "The one in which she gets a Regina George-confident answer, catches the Chutney detail, and checks the timeline before it borrows her name.",
    "canonicalUrl": "https://laidies.ai/issues/issue-03",
    "canonRefs": [
      "content/episodes/episode-03.canon.md",
      "content/episodes/issue-03.json",
      "docs/product/take-it-with-me-media.md",
      "operations/video-qa/opening-day-playback-binding-v1/manifest.json"
    ],
    "seasonNumber": 1,
    "episodeNumber": 3,
    "releaseDate": "2026-06-17",
    "language": "en",
    "rightsStatus": "HOLD"
  },
  "artwork": [
    {
      "artworkId": "03-master-episode-cover-v1",
      "kind": "MASTER_EPISODE_COVER",
      "sourcePath": "assets/media/opening-day-covers-v1/03/03-master.jpg",
      "sha256": "a77b94710887d5db1cd7167fa69f2e3ba5cc7bfa023b31e01148b50323562a36",
      "width": 3000,
      "height": 3000,
      "derivedFrom": "operations/design-explorations/laidies-motion-ident-20260725/continuous-i-episode-03-the-burn-book-problem-clean-electric-v2-still.png",
      "focalPoint": {
        "x": 0.5,
        "y": 0.5
      },
      "safeAreaNotes": "Exact held derivative from the canonical programme identity; visual acceptance remains open.",
      "approvalStatus": "HOLD",
      "approvalRef": null,
      "creator": "LAiDIES",
      "rightsStatus": "PASS",
      "altText": "LAiDIES The Burn Book Problem cover artwork."
    },
    {
      "artworkId": "03-youtube-thumbnail-v1",
      "kind": "YOUTUBE_THUMBNAIL",
      "sourcePath": "assets/media/opening-day-covers-v1/03/03-youtube.jpg",
      "sha256": "92f23b425a38c13376cbfe954a82aa09f794f4ee4588cda9cad177de61d9ea77",
      "width": 1280,
      "height": 720,
      "derivedFrom": "operations/design-explorations/laidies-motion-ident-20260725/continuous-i-episode-03-the-burn-book-problem-clean-electric-v2-still.png",
      "focalPoint": {
        "x": 0.5,
        "y": 0.5
      },
      "safeAreaNotes": "Exact held derivative from the canonical programme identity; visual acceptance remains open.",
      "approvalStatus": "HOLD",
      "approvalRef": null,
      "creator": "LAiDIES",
      "rightsStatus": "PASS",
      "altText": "LAiDIES The Burn Book Problem cover artwork."
    },
    {
      "artworkId": "03-site-poster-v1",
      "kind": "SITE_POSTER",
      "sourcePath": "assets/media/opening-day-covers-v1/03/03-site.jpg",
      "sha256": "459fc05d1e36a28f87bc91a373b01ad1c4827eff9b8326ce43867c8854d33b9f",
      "width": 1600,
      "height": 900,
      "derivedFrom": "operations/design-explorations/laidies-motion-ident-20260725/continuous-i-episode-03-the-burn-book-problem-clean-electric-v2-still.png",
      "focalPoint": {
        "x": 0.5,
        "y": 0.5
      },
      "safeAreaNotes": "Exact held derivative from the canonical programme identity; visual acceptance remains open.",
      "approvalStatus": "HOLD",
      "approvalRef": null,
      "creator": "LAiDIES",
      "rightsStatus": "PASS",
      "altText": "LAiDIES The Burn Book Problem cover artwork."
    },
    {
      "artworkId": "03-share-image-v1",
      "kind": "SHARE_IMAGE",
      "sourcePath": "assets/media/opening-day-covers-v1/03/03-share.jpg",
      "sha256": "01f2b3080af5607c2972d2592647c42148e354128e45ae568e11b1e8c7a3cf9b",
      "width": 1080,
      "height": 1350,
      "derivedFrom": "operations/design-explorations/laidies-motion-ident-20260725/continuous-i-episode-03-the-burn-book-problem-clean-electric-v2-still.png",
      "focalPoint": {
        "x": 0.5,
        "y": 0.5
      },
      "safeAreaNotes": "Exact held derivative from the canonical programme identity; visual acceptance remains open.",
      "approvalStatus": "HOLD",
      "approvalRef": null,
      "creator": "LAiDIES",
      "rightsStatus": "PASS",
      "altText": "LAiDIES The Burn Book Problem cover artwork."
    }
  ],
  "assets": [
    {
      "role": "VISUAL_MASTER",
      "sourcePath": "assets/video/episode-03-full-v15-repaired-review.mp4",
      "publicUrl": null,
      "sha256": "6a7f2381666b355ad05d7df62f896df931147a04a00e45f5bf01c6f19c735b75",
      "mimeType": "video/mp4",
      "durationSeconds": 1048,
      "admissionStatus": "HOLD"
    },
    {
      "role": "AUDIO_MASTER",
      "sourcePath": "assets/media/opening-day-portable-v1/03/03-audio-master-v1.m4a",
      "publicUrl": null,
      "sha256": "5ede1f54363b8aacd46de32586efbca3e2ca1aee11b4bc497f736678312d806b",
      "mimeType": "audio/mp4",
      "durationSeconds": 1048.0,
      "admissionStatus": "HOLD"
    },
    {
      "role": "CAPTIONS_VTT",
      "sourcePath": "assets/captions/episode-03.vtt",
      "publicUrl": null,
      "sha256": "aed14506fe7d399f0a77c391fa1e046746a920d86b65880093b30f0fc83c66be",
      "mimeType": "text/vtt",
      "durationSeconds": null,
      "admissionStatus": "HOLD"
    },
    {
      "role": "TRANSCRIPT",
      "sourcePath": "assets/media/opening-day-portable-v1/03/03-transcript-v1.txt",
      "publicUrl": null,
      "sha256": "6c3361eb764c46398cf7eaaa625b08d6695aef9e601b7ed94a8bfbc39f193eb0",
      "mimeType": "text/plain",
      "durationSeconds": null,
      "admissionStatus": "HOLD"
    }
  ],
  "destinations": [
    {
      "name": "SITE",
      "status": "HOLD",
      "publicUrl": null,
      "deliveryId": null,
      "verificationRef": null
    },
    {
      "name": "APPLE_PODCASTS",
      "status": "HOLD",
      "publicUrl": null,
      "deliveryId": null,
      "verificationRef": null
    },
    {
      "name": "SPOTIFY_PODCASTS",
      "status": "HOLD",
      "publicUrl": null,
      "deliveryId": null,
      "verificationRef": null
    },
    {
      "name": "YOUTUBE",
      "status": "HOLD",
      "publicUrl": null,
      "deliveryId": null,
      "verificationRef": null
    }
  ],
  "freshness": {
    "signalIds": [],
    "workOrderIds": [],
    "lastCheckedAt": null
  },
  "correctionPropagation": {
    "affectedConsumers": [
      {
        "consumer": "site-player",
        "disposition": "HOLD",
        "evidence": "Exact package is built locally; independent human AV review and release admission remain open."
      },
      {
        "consumer": "podcast-rss",
        "disposition": "HOLD",
        "evidence": "Exact package is built locally; independent human AV review and release admission remain open."
      },
      {
        "consumer": "YouTube",
        "disposition": "HOLD",
        "evidence": "Exact package is built locally; independent human AV review and release admission remain open."
      },
      {
        "consumer": "search-and-related-learning",
        "disposition": "HOLD",
        "evidence": "Exact package is built locally; independent human AV review and release admission remain open."
      }
    ],
    "complete": false
  },
  "releaseReceipt": null
}
